324.json	mostly-true	Hillary Clinton agrees with John McCain "by voting to give George Bush the benefit of the doubt on Iran."	foreign-policy	barack-obama	President	Illinois	democrat	70	71	160	163	9	Denver
12465.json	true	The Chicago Bears have had more starting quarterbacks in the last 10 years than the total number of tenured (UW) faculty fired during the last two decades.	education	robin-vos	Wisconsin Assembly speaker	Wisconsin	republican	0	3	2	5	1	a an online opinion-piece
9741.json	mostly-true	Says GOP primary opponents Glenn Grothman and Joe Leibham cast a compromise vote that cost $788 million in higher electricity costs.	energy,message-machine-2014,voting-record	duey-stroebel	State representative	Wisconsin	republican	0	0	0	1	0	an online video
7115.json	mostly-true	For the first time in history, the share of the national popular vote margin is smaller than the Latino vote margin.	elections	robert-menendez	U.S. Senator	New Jersey	democrat	1	3	1	3	0	a speech
8616.json	mostly-true	The economy bled $24 billion due to the government shutdown.	economy,federal-budget,health-care	doonesbury			none	0	0	2	4	0	a Doonesbury strip in the Sunday comics
620.json	true	"McCain opposed a requirement that the government buy American-made motorcycles. And he said all buy-American provisions were quote 'disgraceful.' "	federal-budget	barack-obama	President	Illinois	democrat	70	71	160	163	9	a radio ad
12385.json	mostly-true	Almost 100,000 people left Puerto Rico last year.	bankruptcy,economy,population	jack-lew	Treasury secretary 	Washington, D.C. 	democrat	0	1	0	1	0	an interview with Bloomberg News
9867.json	mostly-true	The United States has the highest corporate tax rate in the free world.	corporations,taxes	eric-bolling	Co-host on Fox News Channel's "The Five"		none	2	1	1	1	0	a discussion on Fox News' "The Five"
12408.json	mostly-true	We just had the best year for the auto industry in America in history.	economy	hillary-clinton	Presidential candidate	New York	democrat	40	29	69	76	7	remarks at a Kentucky rally
12517.json	mostly-true	Hate crimes against American Muslims and mosques have tripled after Paris and San Bernardino.	crime,diversity,homeland-security,terrorism	hillary-clinton	Presidential candidate	New York	democrat	40	29	69	76	7	a speech after a terrorist attack in Orlando
12163.json	mostly-true	Youth unemployment in minority communities is about 40 to 45 percent.	diversity,economy,jobs	peter-kinder	Lieutenant governor	Missouri	republican	0	0	0	1	1	a gubernatorial debate
13237.json	true	Says Paul Ryan is still endorsing Trump.	candidates-biography,elections,campaign-advertising	hillary-clinton	Presidential candidate	New York	democrat	40	29	69	76	7	a tweet
8239.json	mostly-true	We cut business taxes so today 70 percent of our businesses dont pay a business tax.	small-business,taxes	rick-scott	Governor	Florida	republican	28	23	38	34	7	a speech at an Americans for Prosperity Foundation conference
10121.json	mostly-true	Says Mark Pryor votes with Obama 93 percent of the time.	bipartisanship,voting-record	tom-cotton	U.S. House of Representatives	Arkansas	republican	3	4	2	3	1	a debate
7550.json	true	We have a federal government that thinks they have the authority to regulate our toilet seats.	consumer-safety,corrections-and-updates,government-regulation,market-regulation,states,supreme-court,workers	ted-cruz	Senator	Texas	republican	36	33	15	19	8	a speech at CPAC
9018.json	true	Austin is a city that has basically doubled in size every 25 years or so since it was founded.	city-government,population	lee-leffingwell	Austin mayor	Texas	democrat	1	0	4	1	0	his "State of the City" address
1038.json	true	The nuclear test conducted in our nation this time is the Earth's 2,054th nuclear test. The five permanent members of the U.N. Security Council have conducted 99.99 percent of the total nuclear tests.	military	north-korea			none	0	0	0	0	0	a released statement
8492.json	true	Under President George W. Bush, we added $4.9 trillion to the debt. Under President Obama weve added $6.5 trillion to the debt.	debt	kelly-ayotte	U.S. Senator	New Hampshire	republican	2	1	1	4	0	a town hall meeting in Hudson, N.H.
13503.json	true	Hillary Clinton in 2005 co-sponsored legislation that would jail flag burners.	patriotism	blog-posting			none	7	19	3	5	44	Townhall.com 
12758.json	true	We created 800,000 new jobs, we cut the unemployment rate almost in half and today New York State has more private sector jobs than it has ever had in its history	jobs	andrew-cuomo	Governor	New York	democrat	1	0	0	1	0	a conversation with reporters in Victor, NY.
7548.json	mostly-true	In 2008, only 54 percent of Latinos in Texas were registered to vote and only 35 percent actually turned out.	elections,population	battleground-texas		Texas	democrat	0	0	0	1	0	an adviser's interview on the "Colbert Report."
321.json	mostly-true	Said he's the only Republican candidate "who's actually turned around a government economy."	job-accomplishments	rudy-giuliani	Attorney	New York	republican	9	11	10	7	3	a debate in Boca Raton, Fla.
1779.json	true	On military recruiters at Harvard, Elena Kagan "took a position and the Supreme Court ruled unanimously that she was wrong."	education,gays-and-lesbians,kagan-nomination,military,supreme-court	john-barrasso	Senator	Wyoming	republican	1	0	0	0	0	an interview on Fox News
1833.json	mostly-true	There are 321,092 public school teachers in Texas. And there are 313,850 non-teachers in our public schools.	education,message-machine,taxes	empower-texans		Texas	none	1	0	0	1	0	a Web video
6612.json	true	At Bain Capital, we helped start an early childhood learning company called Bright Horizons that First Lady Michelle Obama rightly praised.	candidates-biography,job-accomplishments	mitt-romney	Former governor	Massachusetts	republican	34	32	58	33	19	remarks at the Republican National Convention in Tampa
3786.json	true	If you take the population growth here in Virginia, we are net zero on job creation since (Bob McDonnell) became governor.	jobs	terry-mcauliffe	Governor	Virginia	democrat	12	6	2	2	3	a speech.
1738.json	mostly-true	The new Arizona immigration law "says that any police officer can stop anyone who appears to them to be reasonably suspicious of being an undocumented person."	immigration,legal-issues	alfredo-gutierrez	Former state Senator	Arizona	democrat	0	0	0	1	0	an interview on MSNBC's Hardball
7425.json	mostly-true	The only time in our history when the debt has been higher than this was the end of World War II.	debt	david-cote	President and CEO of Honeywell International		none	0	0	0	1	0	a speech during a “Fix the Debt” press event
10039.json	mostly-true	The cost of health care is now the single-biggest factor driving down the federal budget deficit.	deficit,federal-budget,health-care	barack-obama	President	Illinois	democrat	70	71	160	163	9	a speech at Northwestern University
2166.json	true	During the recession, the consumer in his native perversity has begun to save. The savings rate is now 6.2 percent.	economy,abc-news-week	george-will	Columnist	Maryland	columnist	7	6	3	5	1	a roundtable discussion on ABC's "This Week"
10053.json	true	Says Scott Brown co-sponsored legislation to let employers deny women coverage for birth control.	health-care,legal-issues,women	jeanne-shaheen	Senator	New Hampshire	democrat	3	0	4	2	0	a news release
9989.json	true	Says U.S. Rep. Steve Southerland voted to keep the shutdown going.	federal-budget	gwen-graham		Florida	democrat	0	0	1	0	0	a campaign commercial
11657.json	mostly-true	There is a federal criminal law that says its a crime to transport dentures across state lines.	public-health	bob-goodlatte	U.S. Congressman	Virginia	republican	0	1	4	3	0	a radio interview.
11131.json	mostly-true	We built a new prison every 10 days between 1990 and 2005 to keep up with our mass incarceration explosion of nonviolent offenders.	crime,criminal-justice	cory-booker	U.S. senator	New Jersey	democrat	0	4	2	8	0	a post on Instagram
10386.json	true	I belong to the AFL-CIO.	candidates-biography,labor	rick-perry	Governor	Texas	republican	30	30	42	23	18	Texas Public Policy Foundation policy orientation
2020.json	mostly-true	The insurance commissioner cant do squat about health care.	health-care	ralph-hudgens		Georgia	republican	0	0	0	1	0	a radio interview broadcast over the Internet
9213.json	true	Did you know US population growth is at its lowest since the Great Depression?	immigration,population	robert-sarvis	lawyer, businessman	Virginia	libertarian	0	0	0	1	0	a tweet.
7599.json	mostly-true	The average student in Florida, what they actually pay out of pocket at our major universities for tuition is as much or less than what they spend on cellphones.	education	will-weatherford	State Representative	Florida	republican	2	3	4	3	0	a Board of Governors meeting
7258.json	true	Since 1968, more Americans have died from gunfire than died in all the wars of this countrys history.	guns	mark-shields	Columnist and commentator	Washington, D.C.	none	1	0	0	0	0	the PBS NewsHour
7128.json	mostly-true	A foreclosure tax that would take effect in 2013 could mean a high tax bill for those facing foreclosure and millions of families who modified their mortgage or had a short sale through their lender.	housing	national-association-realtors			none	0	0	0	1	0	a web post
10072.json	mostly-true	Raising the minimum wage to $10.10 an hour, would help lift over a million Americans out of poverty.	income,message-machine-2014,poverty	alison-lundergan-grimes	Secretary of State	Kentucky	democrat	2	2	3	1	0	a debate
10624.json	mostly-true	Says Secretary of State John Kerry, when he was a senator, flew to Managua and met with a communist dictator there, Daniel Ortega, and accused the Reagan administration of engaging in terrorism.	foreign-policy,history,terrorism	mitch-mcconnell	Senate minority leader	Kentucky	republican	7	6	5	7	0	an interview on CNN's "State of the Union"
338.json	true	"Sen. Obama has always had a 100 percent prochoice rating."	abortion	barack-obama	President	Illinois	democrat	70	71	160	163	9	an e-mail message sent to voters before Super Tuesday.
2820.json	true	The (federal) debt is growing by more than $4 billion a day.	deficit,economy,federal-budget	rick-perry	Governor	Texas	republican	30	30	42	23	18	in "Fed Up! Our Fight to Save America from Washington"
7467.json	mostly-true	Two-thirds of Wisconsinites receiving unemployment checks are not required to search for work due to current work search exemptions.	government-regulation,jobs,poverty,welfare	scott-walker	Milwaukee County Executive	Wisconsin	republican	26	41	32	40	11	a speech
10423.json	true	The economy is creating jobs at the fastest pace since 1999.	economy,jobs	barack-obama	President	Illinois	democrat	70	71	160	163	9	the State of the Union address
6767.json	mostly-true	President Obama decided not to meet with Prime Minister Benjamin Netanyahu in New York.	foreign-policy,israel,message-machine-2012	adam-hasner		Florida	republican	2	1	4	4	0	a press release from the Mitt Romney campaign
11043.json	mostly-true	In a majority of states, you can now marry freely, but can still be fired for who you love.	civil-rights,gays-and-lesbians,states	mark-pocan	State Assembly member, 78th District	Wisconsin	democrat	1	2	2	3	0	a statement
12593.json	mostly-true	After Britains vote to leave the European Union, within 24 hours, Americans lost $100 billion from our 401(k)s.	economy,retirement	hillary-clinton	Presidential candidate	New York	democrat	40	29	69	76	7	remarks in Cincinnati, Ohio
8164.json	mostly-true	Medicaid spending declined by 1.9 percent in 2012, the second such decline in 47 years.	medicaid	kathleen-sebelius	U.S. Health and Human Services Secretary	Kansas	democrat	1	0	1	3	1	a speech
6520.json	true	Says 88 Texas constables have died in the line of duty.	crime,criminal-justice,history,public-safety,public-service	bruce-elfant	Constable, Travis County, Precinct 5	Texas	democrat	0	0	0	1	0	a press statement.
9500.json	mostly-true	Gov. Rick Scott cut the cost of prepaid college tuition by nearly $20,000.	education	republican-party-florida			republican	10	6	6	6	4	a TV ad
4629.json	mostly-true	The city of Columbus would save $41 million a year if employees had to contribute to their own, guaranteed-check pensions.	jobs,labor,unions	dave-yost	Ohio auditor	ohio	republican	1	0	0	1	0	a newspaper column
1593.json	true	"As Florida's CFO, I shut down Krakow's scam and refunded more than $1.2 million to Josephine and other victims of this con man."	job-accomplishments	alex-sink		Florida	democrat	1	2	2	4	0	a fundraising e-mail to supporters
10560.json	mostly-true	You had more women getting computer sciences degrees in the 80s by a factor of 2-plus than you do now.	education,technology,women	hillary-clinton	Presidential candidate	New York	democrat	40	29	69	76	7	a conference in Silicon Valley
3836.json	mostly-true	Some neighborhood schools are closing.	education,state-budget	texas-house-democratic-caucus		Texas	democrat	0	0	0	1	0	a press release
325.json	mostly-true	"He told gay organizers in Massachusetts he would be a stronger advocate for special rights than even Ted Kennedy."	gays-and-lesbians	john-mccain	U.S. senator	Arizona	republican	31	39	31	37	8	an automated call to voters
2555.json	mostly-true	The years that I was speaker, the Florida House consistently offered leaner budgets than the governor offered.	state-budget,taxes	marco-rubio	U.S. Senator	Florida	republican	33	24	32	35	5	an ABC News U.S. Senate debate.
8985.json	true	Says the U.S. Supreme Court found that Social Security is not guaranteed.	social-security	david-jolly		Florida	republican	4	0	1	1	0	a Congressional campaign debate
2932.json	true	Oregonians have an amazing no-cost way to fight abortion with free political donations	abortion,campaign-finance	oregon-right-life-pac	politican action committee	Oregon	none	0	0	0	0	0	a newspaper ad
4884.json	mostly-true	Newt Gingrichs immigration plan offers a new doorway to amnesty.	immigration	mitt-romney	Former governor	Massachusetts	republican	34	32	58	33	19	a press conference
10947.json	mostly-true	In just 17 years, spending for Social Security, federal health care and interest on the debt will exceed ALL tax revenue!	debt,federal-budget,taxes	dave-brat	College professor	Virginia	republican	2	5	0	2	0	a Facebook post
12014.json	mostly-true	President Obama took more money from Wall Street in the 2008 campaign than anybody ever had.	campaign-finance,economy,elections,financial-regulation,history,stimulus,voting-record	hillary-clinton	Presidential candidate	New York	democrat	40	29	69	76	7	a Democratic debate in Flint, Mich.
445.json	true	"Hillary Clinton has taken over $800,000 from lobbyists."	ethics	barack-obama	President	Illinois	democrat	70	71	160	163	9	an online ad.
6827.json	mostly-true	Were now spending 42 percent of our economy on government.	debates,federal-budget,government-efficiency	mitt-romney	Former governor	Massachusetts	republican	34	32	58	33	19	the first presidential debate in Denver
3054.json	true	Whether you like to admit it or not, half our general revenue goes to education.	education,state-budget	mike-haridopolos	Florida Senate President	Florida	republican	0	3	1	1	0	comments to reporters.
12683.json	mostly-true	(Mexican immigrants) are more law-abiding than U.S. citizens and that is a statistic.	immigration	gary-johnson	Presidential candidate	New Mexico	libertarian	3	2	5	6	0	an interview on CNN
9554.json	true	There are already more American jobs in the solar industry than in coal mining.	climate-change,energy,environment,jobs	sheldon-whitehouse	U.S. Senator	Rhode Island	democrat	2	3	2	7	0	a newspaper commentary
81.json	mostly-true	Romney failed to take action against "sanctuary cities" in Massachusetts.	immigration	rudy-giuliani	Attorney	New York	republican	9	11	10	7	3	St. Petersburg, Fla.
8754.json	mostly-true	We have been in Afghanistan longer now than we have been in any foreign land conducting a war in our nations history.	afghanistan	robert-gibbs	Former White House Press Secretary		democrat	1	1	0	1	0	an interview on NBC's "Meet the Press"
2537.json	true	Webster sponsored a bill to create a form of marriage that would trap women in abusive relationships.	marriage,message-machine,women	alan-grayson	U.S. House of Representatives	Florida	democrat	6	5	4	11	1	a TV ad.
4681.json	true	Says judges get better benefits at a lower cost than everybody else in the state.	pensions	chris-christie	Governor of New Jersey	New Jersey	republican	10	17	27	19	8	a news conference
5524.json	true	There are a lot of casinos across the country that have gone bankrupt.	bankruptcy,economy,gambling,state-budget,state-finances,states	robert-jacquard	State representative	Rhode Island	democrat	0	0	0	0	0	a speech
5044.json	true	Small businesses create 70 percent of the jobs in America.	economy,jobs,small-business	eric-cantor	House Majority Leader	Virginia	republican	9	6	4	4	4	a news release.
13069.json	mostly-true	If Texas were a country our economy would rank # 10...in the WORLD.	corrections-and-updates,economy,states	greg-abbott	governor	Texas	republican	11	3	8	6	5	a tweet
2802.json	mostly-true	It is a commitment voters take very seriously: The only incumbent in Ohio to break his Pledge and vote for Ted Stricklands income tax hike was defeated soundly on Tuesday.	elections,taxes	americans-tax-reform			none	4	0	1	1	1	a news release
2269.json	mostly-true	The Republicans have 2 percent of the Muslim vote.	religion	tamara-holder	attorney and contributor to Fox News	Illinois 	none	0	0	0	1	0	comments on the Hannity show.
7243.json	mostly-true	[W]e see Americas prison population exploding, with America having a greater percentage of its people behind bars than any other nation in the world!	criminal-justice	hank-johnson	U.S. Congressman	Georgia	democrat	3	0	4	3	0	a letter
1053.json	true	In Texas, the No. 1 name for new male babies many of whom will vote one day is Jose.	elections,immigration,pundits	mike-murphy	political strategist		republican	0	0	0	0	0	a column in Time magazine.
11731.json	mostly-true	Marco Rubio voted against authorizing President Obama to strike Syria after Assad used chemical weapons on his own people.	candidates-biography,congress,foreign-policy,history,terrorism	hillary-clinton	Presidential candidate	New York	democrat	40	29	69	76	7	a posting on the Clinton website
4368.json	mostly-true	Point Pleasant Beach does not own its beaches; they are privately owned and operated by businesses such as Jenkinsons	environment,income	vincent-barrella	Mayor, Point Pleasant Beach	New Jersey	independent	0	0	0	1	0	a column published on NJ.com
2550.json	true	Says Rep. Jim Weidner proposed a bill taking away health care for 80,000 of Oregons children.	health-care,taxes	blue-oregon	liberal blog	Oregon	democrat	0	0	0	0	0	a website posting
7123.json	true	Says that in the 1985 election former Gov. Tom Kean had the largest winning margin for a gubernatorial candidate in Jersey history.	elections,states	raymond-bateman			republican	0	1	0	0	0	a column
772.json	true	"You ... said that Barack Obama was not ready to be commander in chief."	candidates-biography	sarah-palin		Alaska	republican	9	19	9	6	6	St. Louis, Mo.
8766.json	mostly-true	The median male worker in this country has not seen a raise, inflation adjusted, for 30 years, basically.	economy,jobs,labor,workers	rana-foroohar	Assistant managing editor for Time		none	0	0	0	1	0	a CNN interview
10764.json	true	Im the only member of the House of Representatives who raised most of his campaign funds in the last election from small contributions of less than $200.	campaign-finance	alan-grayson	U.S. House of Representatives	Florida	democrat	6	5	4	11	1	an interview with Democracy Now
7261.json	true	Unlike the gridlock in Washington, more than 80 percent of the bills we passed during this General Assembly had bipartisan support.	bipartisanship,job-accomplishments	tom-niehaus	President of the Ohio Senate	Ohio	republican	0	0	0	0	1	an online video
1434.json	mostly-true	"At the beginning of the last decade ... America had a budget surplus of over $200 billion. By the time I took office, we had a one-year deficit of over $1 trillion and projected deficits of $8 trillion over the next decade."	economy,federal-budget	barack-obama	President	Illinois	democrat	70	71	160	163	9	his State of the Union speech
2258.json	true	U.S. taxpayers are being forced to fund Feisal Abdul Raufs trip to the Middle East.	foreign-policy,religion,terrorism	ileana-ros-lehtinen	U.S. Representative	Florida	republican	0	0	1	0	0	a press release.
13380.json	mostly-true	There are Justice Department policies against FBI Director James Comey discussing details of a federal investigation so close to an election.	criminal-justice,government-regulation	robby-mook	Campaign manager for Hillary Clinton	New York	democrat	0	0	0	2	0	comments on "Meet the Press"
1419.json	true	Democratic presidents "have been considerably more effective at creating private-sector jobs."	economy,history,workers	carolyn-maloney	U.S. Representative	New York	democrat	0	0	0	0	0	a floor speech in the House
681.json	true	Joe Biden "voted against the first Gulf War. He opposed the surge. He wanted to partition Iraq."	iraq	lindsey-graham	U.S. senator	South Carolina	republican	2	2	4	2	0	an interview on ABC News' <i> This Week </i>
7754.json	mostly-true	Says that under Rick Perrys plan, Texas has cut funding for public schools by 25%.	children,education,state-budget,state-finances	fix-austin-schools			none	0	0	0	1	0	a leaflet.
3806.json	mostly-true	The Paul Ryan budget proposal would privatize Medicare.	federal-budget,health-care,medicare	agenda-project	Liberal advocacy group	New York	none	0	1	0	1	0	an advertisement
6881.json	mostly-true	High school students arrested on campus are twice as likely not to graduate and four times less likely to graduate if theyve appeared in court.	criminal-justice,education	steven-teske	Clayton County Juvenile Court Judge		none	0	0	0	1	0	an article
10570.json	mostly-true	...Over 30 years, federal spending on education has grown by 375 percent, but test scores remain flat.	education,federal-budget	dave-brat	College professor	Virginia	republican	2	5	0	2	0	a Facebook post.
4811.json	true	The American healthcare system burns 18 percent of our national GDP. Nobody else is close.	federal-budget,health-care	sheldon-whitehouse	U.S. Senator	Rhode Island	democrat	2	3	2	7	0	a speech
5627.json	true	Says you need a photo ID to purchase Sudafed in Texas.	elections,legal-issues	rick-perry	Governor	Texas	republican	30	30	42	23	18	a Fox News interview.
4812.json	mostly-true	Twenty percent of housing in Portlands Pearl District is affordable.	housing,infrastructure,taxes,urban	tom-hughes	Metro president	Oregon	democrat	0	0	0	1	0	a guest column
4327.json	mostly-true	Says allowing the payroll tax holiday to expire would end up costing another estimated 900,000 jobs in 2012.	taxes	jeff-merkley	U.S. Senator	Oregon	democrat	0	1	3	6	0	letter to a constituent
975.json	true	Obama's budget plan would take national debt up to about 80 percent of gross national product. ... Historically, it's been about 40 percent.	federal-budget	judd-gregg	U.S. Senator		republican	0	0	0	1	0	a Fox News interview
1226.json	mostly-true	In the 1950s, "A lot of people got rich and they had to pay a top tax rate of 90 percent."	taxes	michael-moore	Documentary filmmaker		none	2	5	1	6	0	in his movie "Capitalism: A Love Story"
11656.json	mostly-true	The Charleston, S.C., shootershould have never been given a gun, but the universal background check was not fast enough.	corrections-and-updates,guns,homeland-security	hillary-clinton	Presidential candidate	New York	democrat	40	29	69	76	7	an interview with George Stephanopoulos
968.json	true	Warren (Buffett) still does support me.	economy	barack-obama	President	Illinois	democrat	70	71	160	163	9	a television interview
5922.json	true	Says George LeMieux was one of two Republicans who voted for President Barack Obamas jobs bill.	candidates-biography,jobs	connie-mack	U.S. representative from Fort Myers	Florida	republican	3	3	1	3	1	a Web ad
5813.json	mostly-true	About 230,000 people that were on unemployment when I took office are not on unemployment now.	economy,workers	rick-scott	Governor	Florida	republican	28	23	38	34	7	radio interview
1391.json	true	During his tenure as mayor, he saw Houstons crime rates drop to the lowest levels in more than 25 years.	crime	bill-white	Former mayor of Houston	Texas	democrat	2	3	5	7	3	the biography on his campaign Web site
7233.json	mostly-true	Since the federal Violence Against Women Act was adopted in 1994, cases of domestic violence have fallen by 67 percent.	crime,criminal-justice,women	gwen-moore	U.S. House member -- 4th District	Wisconsin	democrat	3	4	4	3	1	a letter to congressional leadership
4649.json	true	Nearly half of all pregnancies in the U.S. are unintended.	abortion,census,children,families,health-care,public-health,women	edith-ajello	Rhode Island State Representative	Rhode Island	democrat	0	1	0	0	0	commentary piece
12497.json	true	Since 1978, college tuition nationwide has gone up something like four times the rate of inflation.	education	scott-walker	Milwaukee County Executive	Wisconsin	republican	26	41	32	40	11	a radio interview
4893.json	mostly-true	Most of, if not all of, the [DeKalb school construction] projects always came in on or were under budget.	education	thomas-brown		Georgia	democrat	0	0	0	1	0	an interview
6627.json	mostly-true	Seven presidents before (Barack Obama) -- Republicans and Democrats -- tried to expand health care to all Americans.	health-care,history	julian-castro	Mayor, San Antonio	Texas	democrat	0	0	3	3	0	a keynote speech to the Democratic National Convention in Charlotte, N.C.
599.json	true	"I have repeatedly said that many of the predatory loans that were made in the mortgage system did target African-American and Latino communities."	economy	barack-obama	President	Illinois	democrat	70	71	160	163	9	a town hall in St. Petersburg, Fla.
