3126.json	mostly-true	Of the topfive cities for staged automobile accidents, three are in Florida. We rank No. 1 in the country in staged auto accidents.	consumer-safety,crime	jeff-atwater	State Senator	Florida	republican	0	1	1	1	0	a meeting with reporters in Tallahassee
7896.json	true	The Pink Pony club in DeKalb County has never been cited for any violation of an ordinance or state law.	legal-issues	pink-pony			none	0	0	1	0	0	an interview
11673.json	true	Since 2008, Gwinnett Countys population has grown 15 percent, while the county government staff has increased only 1 percent.	census,county-budget,county-government,economy,jobs,public-safety,public-service,workers	charlotte-nash		Georgia	republican	1	0	1	2	0	a statement
8594.json	true	Harry Reid was against (the nuclear option) before he was for it. Mitch McConnell was for it before he was against it. President Obama was against it before he was for it.	congressional-rules	matthew-dowd	Commentator	Texas	independent	0	0	2	4	0	comments on ABC's "This Week"
11107.json	true	Says David Jolly refused to cut spending for a national greenhouse in D.C.	federal-budget	club-growth			none	4	5	4	2	0	a statement
12059.json	true	The Walton family of Walmart ... This one family owns more wealth than the bottom 40 percent of the American people.	economy,wealth	bernie-s	U.S. Senator	Vermont	independent	18	12	22	41	0	a campaign rally.
12753.json	mostly-true	Says Hillary Clinton supported North American Free Trade Agreement), and she supported Chinas entrance into the World Trade Organization. She supported the job-killing trade deal with South Korea. She supported the Trans-Pacific Partnership.	candidates-biography,trade	donald-trump	President-Elect	New York	republican	63	114	51	37	61	a speech at the Republican national convention
3248.json	mostly-true	Says there are Ohio Turnpike workers getting paid $66,000 a year to collect tolls that machines might collect.	government-efficiency,state-budget	john-kasich	Governor of Ohio as of Jan. 10, 2011	Ohio	republican	9	8	10	18	3	a newspaper column
10821.json	true	An audit shows there are 6.5 million people who have active Social Security numbers who are 112 years of age or older,	social-security	mark-warner	U.S. Senator	Virginia	democrat	3	1	6	3	0	a news release.
11632.json	true	Says President Barack Obama will not utter the words radical Islamic terrorism and as matter of policy, nobody in the administration will say the words radical Islamic terrorism.	islam,terrorism	ted-cruz	Senator	Texas	republican	36	33	15	19	8	a news conference.
7511.json	true	More than 64 percent of minimum-wage earners are women.	workers	nancy-pelosi	House Minority Leader	California	democrat	3	7	11	2	3	a news conference
7621.json	mostly-true	Says Obama called Medicaid broken four years ago.	health-care,medicaid	rick-perry	Governor	Texas	republican	30	30	42	23	18	a speech at the Conservative Political Action Conference
10327.json	mostly-true	In the U.S. agreement with the Cuban government, no commitment was made to allowing the establishment of political parties or to even begin the semblance of a transition to a democracy.	foreign-policy,human-rights	marco-rubio	U.S. Senator	Florida	republican	33	24	32	35	5	a press conference
3955.json	mostly-true	Creating 25 jobs in Umatilla County has the same impact as 500 jobs in the metro region.	economy,jobs	john-kitzhaber	Governor of Oregon	Oregon	democrat	1	1	4	4	0	a press release
4459.json	true	Says an amendment specifying when military members may use deadly force does nothing to change existing rules of engagement for American service members.	afghanistan,iraq,legal-issues,voting-record	david-cicilline	mayor of Providence	Rhode Island	democrat	7	4	5	4	1	a letter posted on a blog 
3804.json	true	Sometimes I was the only no vote on the entire board.	voting-record	jeff-brandes	Director of real estate at Tibbetts Holdings LLC, his family's business	Florida	republican	0	0	1	1	0	response to a question about his voting record.
5764.json	mostly-true	Only 14 percent of Catholics agree with the Vaticans position that abortion should be illegal.	abortion,polls,religion,women	jon-obrien	President, Catholics for Choice		activist	0	0	0	1	0	written testimony at a House hearing
84.json	true	"Obama Skips Out On Condemning Left-Wing Attacks On Gen. Petraeus Despite Casting Other 'Important Votes' Earlier And Later In The Day."	iraq	republican-national-committee-republican			republican	6	6	11	5	2	
5284.json	mostly-true	Says U.S. Senate Democrats have gone without any budget at all for more than 1,000 days.	federal-budget	paul-ryan	U.S. Representative	Wisconsin	republican	19	6	16	14	2	a news release
7483.json	mostly-true	For the first time in eight years, our budget also increases funding for persons with disabilities by $36 million to help more disabled people receive community-based services.	disability,medicaid,state-budget	rick-scott	Governor	Florida	republican	28	23	38	34	7	a State of the State speech
7408.json	mostly-true	The majority of (the American people) voted for a Democratic House.	congress,elections	steny-hoyer	House Majority Leader	Maryland	democrat	0	1	3	4	0	a media availability with reporters
4566.json	true	We have the highest corporate tax rate in the world. Its 35 percent.	corporations,jobs,taxes	jim-sensenbrenner	Member of Congress	Wisconsin	republican	2	4	1	0	0	an interview
11329.json	mostly-true	Says Donald Trump was forced to file for bankruptcy not once, not twice, four times.	candidates-biography	carly-fiorina		California	republican	5	5	4	3	2	the CNN debate
2968.json	true	Says that in his first 17 months as president, the United States doubled its world-leading $500 million a year commitment to fighting global AIDS.	federal-budget,foreign-policy,health-care	george-w-bush	President	Texas	republican	0	1	1	1	0	his book, "Decision Points."
5607.json	true	When we passed (the stand your ground law), we said it portends horrific events when peoples lives were put into these situations.	crime,criminal-justice	arthenia-joyner	State senator	Florida	democrat	0	0	0	1	0	an interview
6227.json	mostly-true	The federal government has made investments in science and technology inventing the products that led to the creation of Google.	technology	barack-obama	President	Illinois	democrat	70	71	160	163	9	a speech
5298.json	true	Weve seen more anti-womens choice bills introduced in the first half of this session than weve seen in the last three General Assemblies.	abortion	armond-budish	Minority leader in the Ohio House of Representatives	Ohio	democrat	0	1	2	3	0	a news conference
10576.json	true	Already this calendar year, since January 1, we have had more than 20,000 people come across the border, apprehended, unauthorized.	crime,criminal-justice,immigration	greg-abbott	governor	Texas	republican	11	3	8	6	5	an interview on CBS's "Face the Nation"
6975.json	true	Jim Renacci tried to avoid paying taxes on nearly $14 million that he made.	message-machine-2012,campaign-advertising,taxes	betty-sutton	U.S. representative from Ohio's 13th District	Ohio	democrat	0	2	1	2	1	a campaign commercial
442.json	true	"Barack Obama accepted $200,000 from executives and employees of oil companies."	energy	hillary-clinton	Presidential candidate	New York	democrat	40	29	69	76	7	a TV ad airing in Pennsylvania.
10752.json	true	The unemployment rate among blacks in Texas is 9.5% -- far more than double white unemployment -- and wages have fallen for black workers in Texas since 2000.	economy,education,jobs	texas-organizing-project	Membership-based group	Texas	none	0	0	0	0	0	a press release
3555.json	mostly-true	Over the past decade, the big five oil companies --- BP, Chevron, ConocoPhillips, ExxonMobil and Shell -- made a total profit of nearly $1 trillion.	corporations,energy,taxes	jim-moran	U. S. Congressman	Virginia	democrat	2	1	1	6	1	a news release.
11575.json	mostly-true	Net immigration from Mexico last year was zero. Fact-check me.	immigration	martin-omalley	Maryland governor	Maryland	democrat	3	1	10	4	0	a Democratic debate in Des Moines
2878.json	mostly-true	The Republican plan for tax cuts is to give each millionaire -- the top 1 percent of income in this country -- $83,347 a year in tax cuts.	taxes	alan-grayson	U.S. House of Representatives	Florida	democrat	6	5	4	11	1	a speech on the House floor.
7170.json	true	Fourteen million Americans mortgages are greater than the value of their homes.	economy,housing	dennis-kucinich	U.S. representative	Ohio	democrat	1	3	4	6	0	a speech on the House floor
2431.json	true	Weve created more than 850,000 jobs, more than all the other states combined.	economy,message-machine	rick-perry	Governor	Texas	republican	30	30	42	23	18	a TV ad
11790.json	true	Anyone can die of a toothache.	health-care,medicaid	john-cortes	District 43 state representative	Florida	democrat	0	0	0	0	0	a House Health Innovation Subcommittee meeting
6303.json	true	Says Jim Frishe wanted to tax us for doing our taxes through an accountant.	message-machine-2012,taxes	accountability-government		Florida	none	0	0	0	0	0	a TV ad
9162.json	mostly-true	When Republicans last controlled the presidency and Congress, the number of people on food stamps (and) the number of people in low-income housing went through the roof.	bush-administration,housing,hunger,poverty,welfare	glenn-grothman	State Senator, 20th District	Wisconsin	republican	2	4	1	1	0	a radio interview
9792.json	true	Jason Carter backed three of Nathan Deals budgets but accuses the governor of underfunding education.	education	john-padgett	party chair	Georgia	republican	0	0	0	0	0	press release
8912.json	true	On oil drilling off Floridas coast	environment,oil-spill	charlie-crist		Florida	democrat	15	9	20	19	2	newspaper articles
11991.json	mostly-true	Since (welfare reform) was signed into law, the number of families living in extreme poverty has more than doubled.	welfare	bernie-s	U.S. Senator	Vermont	independent	18	12	22	41	0	a news conference
4976.json	mostly-true	(The Opportunity Scholarship Act) would be funded directly from public school budgets. So it would absolutely take money out of the public school system to transfer to private and religious schools.	education	julia-sass-rubin	Education advocate	New Jersey	none	0	0	0	1	0	an interview on News 12 New Jersey’s Power & Politics show
7421.json	mostly-true	The sequester wont consider whether were cutting some bloated program that has outlived its usefulness, or a vital service that Americans depend on every single day. It doesnt make those distinctions.	federal-budget	barack-obama	President	Illinois	democrat	70	71	160	163	9	a speech in Washington, D.C.
5356.json	true	Says a 1915 referendum on womens right to vote went down in New Jersey. And it took the Legislature to pass it.	women	loretta-weinberg	State Senator		democrat	1	2	0	1	0	an interview on NJTV
10913.json	mostly-true	In the last seven years of my tenure, Texas created 1.5 million new jobs. As a matter of fact, without Texas, America would have lost 400,000 jobs.	corrections-and-updates,economy,jobs,states	rick-perry	Governor	Texas	republican	30	30	42	23	18	his speech declaring his candidacy for president
8221.json	true	Fleeing Syria, a million children are now refugees.	foreign-policy,military	john-mccain	U.S. senator	Arizona	republican	31	39	31	37	8	an interview on "Face the Nation"
5090.json	mostly-true	Says federal spending has increased 21 percent over the past three years.	deficit,economy,federal-budget	rob-portman	U.S. senator from Ohio	Ohio	republican	3	5	11	11	1	a news release
8310.json	true	If the government shuts down, all military personnel will continue to serve and accrue pay but will not actually be paid until appropriations are available.	federal-budget,military	cw-bill-young	U.S. Representative, Florida District 10	Florida	republican	0	1	1	0	1	a House address
8496.json	true	Rand Pauls speech ... on Gattaca was totally ripped off of Wikipedia.	candidates-biography,health-care,pundits	rachel-maddow	MSNBC host		none	6	6	4	6	1	comments on her TV show
10760.json	mostly-true	More astronauts have been to the moon than farmers who paid the inheritance tax in 2013.	taxes	bill-maher	Host of Real Time with Bill Maher	California	independent	0	3	1	5	0	his monologue on "Real Time"
11929.json	mostly-true	Says Hillary Clinton wonhealth care for 8 million children.	health-care,public-health	hillary-clinton	Presidential candidate	New York	democrat	40	29	69	76	7	a TV ad 
11010.json	mostly-true	Income disparities in the United States are the worst since the 1920s.	income,wealth	bobby-scott	U.S. Congressman	Virginia	democrat	1	2	1	5	0	a news release.
8522.json	mostly-true	The University of Texas is starting the first medical school at a major Tier One university in the last 50 years.	education,health-care,public-health	steve-leslie	Assistant to University of Texas president	Texas	none	0	0	0	1	0	remarks at an Austin town hall about the Dell Medical School
5719.json	true	98 percent of American families make under $250,000 a year.	taxes	barack-obama	President	Illinois	democrat	70	71	160	163	9	a speech at Florida Atlantic University in Boca Raton, Fla. 
3290.json	mostly-true	State employees havent received a raise in five or six years.	state-budget	florida-department-corrections-worker		Florida	none	0	0	0	1	0	a question to Gov. Rick Scott.
4217.json	mostly-true	Says more than eight countries lead the United States in the percentage of college graduates.	education	cory-booker	U.S. senator	New Jersey	democrat	0	4	2	8	0	a round table discussion on Meet the Press
10603.json	mostly-true	Georgia is one of only five states where breweries cant sell you a pint of beer to drink on premise or sell you a six-pack to go.	Alcohol,government-regulation,legal-issues	georgia-craft-brewers-guild		Georgia 	none	0	0	0	1	0	a statement
11333.json	mostly-true	Under Republicans, recessions happen four times as frequently as under Democrats.	economy	hillary-clinton	Presidential candidate	New York	democrat	40	29	69	76	7	remarks at the 2015 New Hampshire Democratic Party State Convention
9413.json	true	Four (maybe five) Latinos have served on the Austin City Council.	city-government,history	mike-martinez	Member, Austin City Council	Texas	democrat	1	0	1	1	1	remarks at a gathering
11067.json	mostly-true	Says because of his actions, Wisconsin property taxes today are lower than they were four years ago.	candidates-biography,city-government,education,state-finances,taxes	scott-walker	Milwaukee County Executive	Wisconsin	republican	26	41	32	40	11	a speech
2142.json	true	Democratic candidate Jeff Greene ran for Congress as a California Republican.	candidates-biography,elections,message-machine	kendrick-meek		Florida	democrat	2	6	1	4	1	a television ad
8007.json	mostly-true	Says Obama administration delay of health care laws employer mandate affects about 1 percent of the American workforce.	health-care	robert-menendez	U.S. Senator	New Jersey	democrat	1	3	1	3	0	an interview on NBC’s “Meet the Press”
11011.json	mostly-true	Says Jeb Bush oversaw (an) average in-state tuition increase of 48.2 percent during his tenure.	education	florida-democratic-party		Florida	democrat	5	4	4	5	3	a press release
3462.json	true	The entire state of Florida led the nation last year with the most prison inmates committing tax fraud.	corrections-and-updates,crime,taxes	bill-nelson		Florida	democrat	3	1	8	10	0	a letter to IRS Commissioner Douglas Shulman
12864.json	mostly-true	Mike Pence voted against expanding the Childrens Health Insurance program, which Hillary helped to start.	federal-budget,health-care,medicaid,medicare,poverty,public-health	howard-dean	Democratic National Committee chairman	Vermont	democrat	1	4	1	2	0	in a speech at the Democratic National Convention
3193.json	true	Most state employees could pay twice as much toward their health care premiums and it would still be half the national average	health-care,state-budget	scott-walker	Milwaukee County Executive	Wisconsin	republican	26	41	32	40	11	the State of the State speech
6082.json	mostly-true	Giving the facts: 73,000 jobs created ... since 11. Do you know how many direct jobs in the auto industry? 1,800.	economy,jobs	john-kasich	Governor of Ohio as of Jan. 10, 2011	Ohio	republican	9	8	10	18	3	an appearance on NBC's "Meet the Press."
1407.json	true	"Most Texans aren't millionaires."	economy,elections	linda-chavez-thompson	Labor organizer	Texas	democrat	0	0	0	0	0	a speech
8657.json	mostly-true	The town of Cumberland has its highest bond rating in history.	city-budget,debt,job-accomplishments	daniel-mckee	Mayor	Rhode Island	democrat	0	0	1	2	0	a campaign speech
132.json	mostly-true	"I've seen (life) from the factory floor when I was working the graveyard shift ...and I'd be ankle-deep in water at the Murray Ohio bicycle plant where I was running a machine that was so loud I couldn't hear myself yell if I wanted to."	candidates-biography	fred-thompson	Actor	Tennessee	republican	1	4	3	3	0	Des Moines, Iowa
3296.json	true	If you printed a $1 bill for the entirety of the $14.1 trillion national debt, the resulting pile of money would weigh more than 136 aircraft carriers.	deficit	michael-sullivan	president and ceo, Empower Texans	Texas	republican	1	0	3	1	0	an e-mail blast
6278.json	mostly-true	Eighty out of 82 counties in Ohio ... have an auto manufacturing facility.	economy,jobs	debbie-wasserman-schultz	U.S. Representative, Florida District 23	Florida	democrat	7	9	8	15	3	an interview on "Fox News Sunday"
7705.json	mostly-true	One in five women in the military are receiving unwanted sexual contact, as are 3.3 percent of men.	crime,military,women	kirsten-gillibrand	U.S. Senator	New York	democrat	0	0	1	3	0	an interview with MSNBC
7274.json	true	Virginia spends less per student today than we did in 2008.	education,state-budget	david-toscano	House minority leader 	Virginia	democrat	0	0	0	0	0	a speech.
2861.json	true	More people hunt and fish in Texas in a given year than attend the... games of the Dallas Cowboys, the Dallas Mavericks, the Houston Texans and the Houston Rockets combined.	environment,recreation	todd-staples	state agriculture commissioner	Texas	republican	0	1	4	3	1	an interview.
10421.json	mostly-true	Our unemployment rate is now lower than it was before the financial crisis.	economy,jobs	barack-obama	President	Illinois	democrat	70	71	160	163	9	the State of the Union address
3707.json	mostly-true	We have the highest corporate income tax in the world right now.	taxes	gary-johnson	Presidential candidate	New Mexico	libertarian	3	2	5	6	0	a Republican presidential debate
4.json	mostly-true	"I used tax cuts to help create over 80,000 jobs in New Mexico."	taxes	bill-richardson	Governor	New Mexico	democrat	1	2	3	8	1	a TV Ad.
8928.json	mostly-true	The only time over the last 25 years when the states unemployment rate exceeded the U.S. average was when (Mary) Burke was commerce secretary.	candidates-biography,economy,job-accomplishments,jobs,labor,state-budget	republican-party-wisconsin		Wisconsin	republican	4	3	2	3	0	a news release
439.json	true	"Again today (Ahmadinejad) made light of 9/11, and said that he's not even sure it happened and that people actually died."	foreign-policy	hillary-clinton	Presidential candidate	New York	democrat	40	29	69	76	7	a television debate in Philadelphia.
13105.json	mostly-true	Sixty percent of Americans now support legalizing marijuana.	legal-issues,marijuana,polls,states	gary-johnson	Presidential candidate	New Mexico	libertarian	3	2	5	6	0	an interview
2532.json	true	Since being elected in 2002, Scott Walker has given back over $370,000 of his salary to the county.	county-budget,job-accomplishments	scott-walker	Milwaukee County Executive	Wisconsin	republican	26	41	32	40	11	a statement on campaign web site
1535.json	mostly-true	Florida "has the second-highest foreclosure rate in the nation."	economy,housing	kendrick-meek		Florida	democrat	2	6	1	4	1	a statement on his Web site
10412.json	true	The religious liberty bill proposed in the Georgia House of Representatives does not specifically exclude corporations, which means they can legally claim a religious exemption.	gays-and-lesbians,legal-issues,religion	jeff-graham			independent	0	0	0	0	0	an interview with WABE radio
13314.json	mostly-true	Says Saudi Arabia, a U.S. ally, has paid to export throughout the world Wahhabism -- an extreme form of Islam that basically teaches Americans are the devil.	foreign-policy,islam,religion	russ-feingold		Wisconsin	democrat	2	4	7	5	1	an interview
7028.json	mostly-true	Bill Clinton presided over the biggest expansion of the American economy since World War II.	economy,job-accomplishments	tim-kaine	U.S. Senator	Virginia	democrat	8	3	15	15	0	a debate.
3936.json	mostly-true	An amendment inserted by lawmakers into the state budget exempts scientific researchers from all state animal cruelty laws.	animals,state-budget	wisconsin-humane-society	Outside Group 	Wisconsin	organization	0	0	0	1	0	a news release
2296.json	true	In Rhode Island there are 150 different pension plans for public workers.	economy,public-service,retirement,state-budget,workers	kernan-kerry-king		Rhode Island	republican	0	0	0	0	0	an interview on WPRI-TV's "Newsmakers
9250.json	mostly-true	Dave Brat worked on Democrat Gov. Tim Kaines Council of Economic Advisors while Kaine tried to raise our taxes by over $1 billion.	candidates-biography,economy,state-budget,taxes	eric-cantor	House Majority Leader	Virginia	republican	9	6	4	4	4	a TV ad.
13088.json	mostly-true	Says Hillary Clinton and millennials have the same positions on climate change, abortion rights, immigration reform, gay rights and college affordability. Donald Trump doesnt.	abortion,climate-change,education,gays-and-lesbians,immigration	tim-kaine	U.S. Senator	Virginia	democrat	8	3	15	15	0	an interview on "Meet the Press."
5933.json	true	Says New Jerseys prison system is 61 percent African-American even though our state is just 13 percent black.	criminal-justice	cory-booker	U.S. senator	New Jersey	democrat	0	4	2	8	0	a speech at an American Federation for Children event
7556.json	true	Do you know that, statistically, when you take the SAT a second time, one third of the people that take the SAT, even if theyve been studying, will get a lower score than they did the first time around?	children,education	larry-valencia	freelance 	Rhode Island	democrat	0	0	0	0	0	radio interview
495.json	true	"Sen. Obama has declared, and repeatedly reaffirmed his intention to meet the president of Iran without any preconditions."	foreign-policy	john-mccain	U.S. senator	Arizona	republican	31	39	31	37	8	Chicago
8894.json	mostly-true	We see a quarter-billion dollars in a pension fund that needs to be funded at $1.2 billion.	city-budget,debt,labor,pensions,taxes,workers	daniel-harrop	Psychiatrist	Rhode Island	republican	0	0	0	1	0	an appearance on WPRI-TV's Newsmakers
186.json	true	"I'm proud to have had a 100 percent pro-life voting record."	abortion	fred-thompson	Actor	Tennessee	republican	1	4	3	3	0	
8776.json	mostly-true	Americans are 20 times as likely to die from gun violence as citizens of other civilized countries.	guns	lisa-bloom	Attorney and author	California	none	0	0	0	1	0	an interview with Piers Morgan
8838.json	true	There is more oil produced at home than we buy from the rest of the world the first time thats happened in nearly 20 years.	economy,energy,trade	barack-obama	President	Illinois	democrat	70	71	160	163	9	the State of the Union address
11236.json	true	To vote in Mexico every eligible Mexican citizen has to have a tamper-proof photo-ID card with a thumbprint and an embossed hologram.	elections,history,legal-issues	sid-miller	State agriculture commissioner	Texas	republican	1	2	2	0	1	a meme posted on his Facebook page
1573.json	mostly-true	We are the only industrialized nation that relies heavily on a for-profit medical insurance industry to provide basic health care.	health-care	dianne-feinstein	U.S. Senator	California	democrat	1	1	0	4	0	a New York Times article
12142.json	true	Since 1900, six (U.S. Supreme Court) justices have been confirmed during election years, including Justice Anthony Kennedy, who was confirmed in the final year of the Reagan Administration.	supreme-court	mark-herring	State senator	Virginia	democrat	1	0	0	1	0	a letter
2069.json	mostly-true	Rick Perry accepted more stimulus funds than any other governor except the governors of California and New York.	state-budget,states,stimulus	bill-white	Former mayor of Houston	Texas	democrat	2	3	5	7	3	a speech to the Texas Democratic Party convention in Corpus Christi
11851.json	mostly-true	90 percent of all pain medications are prescribed in the United States.	drugs	jeb-bush		Florida	republican	17	5	17	24	2	an editorial board interview with the Concord Monitor
9069.json	mostly-true	Our state economic development agency under Walker, WEDC, actually isnt even using the funds that are appropriated to it.	jobs	mary-burke	Madison school board member	Wisconsin	democrat	5	5	11	8	3	an interview
11730.json	mostly-true	A violent felon can buy (a gun) over the Internet with no background check, no questions asked.	guns	barack-obama	President	Illinois	democrat	70	71	160	163	9	a speech proposing executive action on gun regulations
1201.json	true	Mathematically, the White Sox can still get in the playoffs.	baseball	barack-obama	President	Illinois	democrat	70	71	160	163	9	an interview on Meet the Press
7465.json	mostly-true	Says a majority of Americans -- and Republicans -- support his approach for deficit reduction.	federal-budget,polls,taxes	barack-obama	President	Illinois	democrat	70	71	160	163	9	a press briefing at the White House
