9347.json	mostly-true	Canadian middle class incomes are now higher than in the United States. They are working fewer hours for more pay, living longer on average, and facing less income inequality.	health-care,income,labor	hillary-clinton	Presidential candidate	New York	democrat	40	29	69	76	7	a speech at the New America Foundation
8745.json	true	The Obama administration has used the Espionage Act to go after whistleblowers who leaked to journalists ... more than all previous administrations combined.	crime,homeland-security,legal-issues	jake-tapper	Host of CNN's "The Lead"		journalist	0	0	0	1	0	a broadcast of CNN's "The Lead with Jake Tapper"
11934.json	mostly-true	In Sauk City, Wisconsin, the ID office that provides identification for voting is only open on the fifth Wednesday of every month -- a total of four days in 2016.	civil-rights,elections,states,transportation	john-oliver	Host, Last Week Tonight		none	0	0	2	4	0	a TV show
4986.json	true	Nevada has been recently ranked No. 1 in unemployment, foreclosures, violent crime, personal bankruptcy and divorce.	gambling	florida-chamber-commerce		Florida	none	0	1	1	2	1	a news article
2259.json	mostly-true	Republican candidate for Georgia governor dabbled in birther conspiracy theories.	obama-birth-certificate	liberal-bloggers			democrat	0	0	0	1	0	liberal blogs
8559.json	true	Says New Jersey has gained 143,000 new private-sector jobs.	jobs	chris-christie	Governor of New Jersey	New Jersey	republican	10	17	27	19	8	interviews on four Sunday morning news shows
7185.json	true	Says the Portland Childrens Levy holds its administrative expenses to less than 5 percent.	children,city-government	dan-saltzman	Portland City Commissioner 	Oregon	democrat	0	0	0	0	0	a television news interview 
6808.json	mostly-true	George Allen voted to end Pell Grants for 84,000 students.	education	tim-kaine	U.S. Senator	Virginia	democrat	8	3	15	15	0	a news release.
11311.json	mostly-true	Amajority of the men and women on this stage have previously and publicly embraced amnesty. I am the only candidate on this stage who has never supportedamnesty.	immigration	ted-cruz	Senator	Texas	republican	36	33	15	19	8	comments during the CNN debate
4222.json	mostly-true	There are no tax increases in this debt limit bill. Period.	federal-budget,taxes	eric-cantor	House Majority Leader	Virginia	republican	9	6	4	4	4	a message on Twitter
1068.json	true	Every year tobacco kills more Americans than did World War II more than AIDS, cocaine, heroin, alcohol, vehicular accidents, homicide and suicide combined.	consumer-safety	george-will	Columnist	Maryland	columnist	7	6	3	5	1	a Washington Post op-ed
7516.json	mostly-true	There are 3.6 million jobs sitting vacant, in part because there arent enough qualified applicants to fill them.	economy,jobs	virginia-foxx	U.S. Representative	North Carolina	republican	0	0	0	1	1	a House floor speech
8777.json	mostly-true	Obama unilaterally announced he was delaying employer mandate through a blog post by a mid-level bureaucrat at the Department of Treasury.	corrections-and-updates,health-care,legal-issues,taxes	ted-cruz	Senator	Texas	republican	36	33	15	19	8	a speech at a Texas Public Policy Foundation forum
2846.json	mostly-true	Because of (U.S. Sen.-elect Ron) Johnsons leadership, Senate Republicans adopted a caucus ban on earmarks.	federal-budget,job-accomplishments	republican-party-wisconsin		Wisconsin	republican	4	3	2	3	0	a news release
118.json	true	"We spent approximately $20-billion of that money on pork barrel, earmark projects. Maybe if we had done it right, maybe some of that money would have gone to inspect those bridges and other bridges across the country."	federal-budget	john-mccain	U.S. senator	Arizona	republican	31	39	31	37	8	a comment to a reporter.
7121.json	mostly-true	When you look at the number of crashes before the cameras were installed compared to after, theyre virtually the same.	public-safety,transportation	steve-acenbrak	transportation director, city of Roswell	Georgia	none	0	0	0	1	0	an article
10260.json	mostly-true	Our median income here in Providence is the same as the median income in Mississippi.	economy,income,poverty	jorge-elorza	Law professor	Rhode Island	democrat	1	1	0	2	0	a TV interview
1426.json	mostly-true	U.S. Sen. Kay Bailey Hutchison voted to continue Roe v. Wade.	abortion	rick-perry	Governor	Texas	republican	30	30	42	23	18	a Republican gubernatorial debate
12095.json	true	We do not have an overcrowding problem. As a matter of fact, Rhode Island has one of the lowest incarceration rates in the country.	criminal-justice	richard-ferruccio	Correctional officer	Rhode Island	newsmaker	0	1	0	0	0	a legislative hearing 
11787.json	mostly-true	Fifty years ago, the average GM employee could pay for a year of a son or daughters college tuition on just two weeks wages.	corporations,corrections-and-updates,education,income,workers	martin-omalley	Maryland governor	Maryland	democrat	3	1	10	4	0	a column posted on Medium.com
8122.json	mostly-true	On average, college students are taking six years to get a four-year degree.	debt,education,jobs	ron-johnson		Wisconsin	republican	14	6	10	10	1	an interview
95.json	true	"I opposed this war from the beginning. I opposed the war in 2002. I opposed the war in 2003. I opposed it in 2004 and 2005 and 2006."	iraq	barack-obama	President	Illinois	democrat	70	71	160	163	9	Clinton, Iowa
8095.json	true	Says the State Department spent $630,000 to get 2 million Facebook Likes.	deficit	rob-portman	U.S. senator from Ohio	Ohio	republican	3	5	11	11	1	a news release
13422.json	mostly-true	I had the longest judicial vacancy in the history of the United States.	candidates-biography,history,job-accomplishments,legal-issues,supreme-court	richard-burr	U.S. Senator	North Carolina	republican	0	0	1	1	0	a private meeting with supporters
10653.json	mostly-true	Says Gov. Scott Walkers proposed reduction in university spending is about the size of the one under Democratic Gov. Jim Doyle, but Democrats didnt treat Doyles cut as so dire.	education	robin-vos	Wisconsin Assembly speaker	Wisconsin	republican	0	3	2	5	1	an interview
3919.json	true	The average unemployed American has been out of work for almost 40 weeks.	economy,jobs,pundits	paul-krugman	New York Times columnist		none	0	2	3	4	0	a New York Times column
1718.json	true	Republican challenger Bill Flores "has never once voted in a general election in our district."	candidates-biography,elections,message-machine	chet-edwards	U.S. House member	Texas	democrat	0	2	0	0	0	a campaign video
1792.json	mostly-true	Says that when he first ran for office in the late 1980s, there were still folks who didnt have phone service. Soon Id helped ensure that everyone in North Florida could access a dial tone.	elections,message-machine	allen-boyd		Florida	democrat	0	1	0	1	0	a TV ad
3338.json	mostly-true	Says the high-speed rail project provides short-term jobs.	jobs,stimulus,transportation	rick-scott	Governor	Florida	republican	28	23	38	34	7	an interview with Fox News.
12211.json	true	Polls showHillary Clinton wins every time with Donald Trump as her opponent.	polls	glenn-beck			none	5	7	7	2	6	an interview on NBC's "Meet the Press"
4554.json	mostly-true	We have a $2 trillion to $3 trillion infrastructure deficit. Weve got work that needs to get done. Weve got people that want to go to work.	economy,infrastructure,jobs	tim-ryan	U.S. representative 	Ohio	democrat	0	0	0	5	1	a television interview
5390.json	mostly-true	The cost ofa gas tank fill-up has risen$30 sinceBarack Obama became president.	energy,gas-prices	george-allen	consultant	Virginia	republican	2	8	3	4	1	an interview.
12639.json	mostly-true	Says Donald Trumps position isto roll back all of the financial regulations passed after the financial crisis.	financial-regulation	elizabeth-warren	U.S. senator	Massachusetts 	democrat	0	0	3	3	0	an interview on The View
3340.json	mostly-true	Says Rep. Paul Ryans budget roadmap doesnt balance the budget until the 2060s and adds an unthinkable $62 trillion to the national debt between now and then.	deficit,federal-budget	matt-miller	Management consultant	California	none	0	0	0	1	0	a column in the Washington Post
608.json	true	"We could save all the oil that they're talking about getting off drilling, if everybody was just inflating their tires and getting regular tune-ups."	energy	barack-obama	President	Illinois	democrat	70	71	160	163	9	Springfield, Mo.
8805.json	true	In the past three years, state legislatures have enacted more of these restrictions (on abortion) than in the previous 10 years combined.	abortion,health-care,women	patty-murray	U.S. Senator	Washington	democrat	0	0	0	0	0	an online statement
3646.json	true	In Senate Bill 5, there is this new method of evaluating teachers. Youre also going to be rated on what the parents think of you and they can send questionnaires and surveys home to parents.	education,labor	tim-grendell	State senator	Ohio	republican	0	1	0	0	0	a forum on the state budget
396.json	true	Obama says Clinton in 2002 suggested there was a connection between al-Qaida and the Iraqi government.	iraq	barack-obama	President	Illinois	democrat	70	71	160	163	9	an interview on MSNBC's "Hardball."
279.json	true	"(Ronald Reagan) raised taxes a billion dollars in his first year as governor of California."	taxes	mike-huckabee	author	Arkansas	republican	12	5	9	3	4	a debate in Myrtle Beach, S.C.
11747.json	true	Our businesses have created jobs every single month since (Obamacare) became law.	economy,health-care,jobs	barack-obama	President	Illinois	democrat	70	71	160	163	9	his State of the Union speech
11715.json	mostly-true	Says Bernie Sanders voted for regime change with respect to Libya.	debates,foreign-policy,terrorism	hillary-clinton	Presidential candidate	New York	democrat	40	29	69	76	7	a Democratic debate in New Hampshire
10415.json	mostly-true	If you ask how many times did Ronald Reagan attend a fundraiser when he ran for re-election in 1984, the answer is eight times. If you say how many times did Barack Obama attend a fundraiser in 2012, the answer is 228 times.	campaign-finance	lawrence-lessig	Professor at Harvard Law School	Massachusetts	activist	0	0	0	1	0	an editorial board interview with the Concord Monitor
3442.json	mostly-true	TheHousebudget plan proposes the largest discretionary spending cut in history.	federal-budget,history	bob-goodlatte	U.S. Congressman	Virginia	republican	0	1	4	3	0	a column.
4364.json	true	Congressional Budget Office says 8 (percent) unemployment till 2014!	economy,jobs	john-cornyn	Senator	Texas	republican	5	3	6	2	1	a Twitter message.
6191.json	true	Oregon schools receive millions of dollars per year in federal school lunch assistance and yet they are required to spend that money almost anywhere but Oregon.	congress,education,federal-budget	ron-wyden	U.S. Senator	Oregon	democrat	0	1	0	3	0	in a news release 
12945.json	true	Almost half a million people are still eligible (for DACA), particularly in the Asian-American and Pacific Islander community.	immigration	hillary-clinton	Presidential candidate	New York	democrat	40	29	69	76	7	a post on Medium
7373.json	mostly-true	I was never against same-sex marriage.	marriage	leah-ward-sears		Georgia	none	0	0	0	1	0	newspaper column
11002.json	mostly-true	Says Hillary Clintons rejection of efforts to make it easier to vote and harder to cheat not only defies logic, but the will of the majority of Americans.	elections	scott-walker	Milwaukee County Executive	Wisconsin	republican	26	41	32	40	11	a statement
2364.json	true	Says state Rep. Diana Maldonado of Round Rock uses Craigslist to hire campaign block walkers.	campaign-finance,workers	larry-gonzales		Texas	republican	0	0	0	0	0	an e-mail to supporters
13302.json	mostly-true	Says Donald Trump saidas recently as a few weeks ago in Phoenix that every undocumented person would be subject to deportation.	candidates-biography,homeland-security,immigration	hillary-clinton	Presidential candidate	New York	democrat	40	29	69	76	7	the third 2016 presidential debate
6557.json	mostly-true	Says a portfolio managed by the Texas General Land Office earned 22 percent last year while the states emergency reserve account experienced a 1 percent gain.	education,state-budget,state-finances	jerry-patterson	state land commissioner	Texas	republican	1	1	1	3	0	a letter.
12070.json	true	Gun violence is by far the leading cause of death for young African American men, outstripping the next nine causes of death combined.	diversity,guns	hillary-clinton	Presidential candidate	New York	democrat	40	29	69	76	7	a speech posted on Medium
12899.json	mostly-true	Says employers are still allowed to pay people with disabilities below the minimum wage.	civil-rights,disability,income,jobs,market-regulation,workers	tom-harkin	U.S. Senator	Iowa	democrat	0	1	1	1	0	in a speech at the Democratic National Convention
3681.json	mostly-true	Says using E-Verify is a fair amount of cost, about $20 per person that does not match.	immigration	jd-alexander	State senator	Florida	republican	0	1	1	1	1	comments to the 'St. Petersburg Times' and 'Miami Herald'
10922.json	mostly-true	In New Jersey, Gov. Christie vetoed legislation to extend early voting.	elections	hillary-clinton	Presidential candidate	New York	democrat	40	29	69	76	7	a speech
8131.json	mostly-true	Says federal regulations adopted in 2011 increased the cost of each vehicle for his business by $10,000.	environment,market-regulation	mike-collins	co-owner, Collins Industries	Georgia	republican	1	0	1	1	0	an interview
7248.json	true	Even if you took literally every single ounce of platinum in the world, it still wouldnt add up to enough needed to pay down our nations debt.	debt	national-republican-congressional-committee			republican	18	9	8	5	8	a press release
6354.json	mostly-true	Says former Sen. George Allen voted four times to raise his own pay.	voting-record	tim-kaine	U.S. Senator	Virginia	democrat	8	3	15	15	0	a debate.
3754.json	mostly-true	Eighty-seven percent of private insurance plans currently include (abortion) coverage.	abortion,health-care	sherrod-brown	U.S. Senator	Ohio	democrat	3	4	5	8	1	a fundraising letter
10665.json	mostly-true	Rhode Island has the second highest per enrollee (Medicaid) cost of any state in the country, which is 60 percent higher than the national average.	economy,federal-budget,government-efficiency,health-care,medicaid,poverty,public-health,market-regulation,state-budget,state-finances,states,taxes	gina-raimondo	venture capital company founder	Rhode Island	democrat	2	1	2	5	1	a television interview
13207.json	mostly-true	Says he fought Obama at the Supreme Court and won.	supreme-court	josh-hawley	Lawyer	Missouri	republican	0	0	0	1	0	a campaign ad
8130.json	true	Says Florida refused to allow theinsurance commissioner to negotiate lower rates with companies or refuse rates that are too high under Obamacare.	health-care,states	ted-deutch		Florida	democrat	0	0	0	0	0	a letter with other Florida lawmakers to HHS Secretary Kathleen Sebelius
11299.json	true	Georgias CRCT set some of the lowest expectations for student proficiency in the nation.	education	richard-woods	state Superintendent	Georgia	republican	0	0	0	0	0	press release
368.json	true	He's been endorsed by "every major newspaper here in the state of Texas."	elections	barack-obama	President	Illinois	democrat	70	71	160	163	9	a debate in Austin, Texas.
1314.json	true	The House of Representatives does not have a prochoice majority.	abortion	loretta-sanchez	member of Congress	California	democrat	0	1	1	0	1	an interview on "Morning Joe"
3797.json	true	To give a sense of how families are struggling, a record four out of every 10 school kids in Ohio now qualifies for subsidized lunch.	children,economy,families,poverty	amy-hanauer	Executive director of Policy Matters Ohio	Ohio	none	0	0	0	0	0	at a rally at the Ohio Statehouse
5423.json	true	Florida is the largest dog-racing state in the country.	animals,gambling,tourism	maria-sachs	Florida senator	Florida	democrat	1	0	0	0	0	a press conference
9863.json	true	We cut our deficits by more than half.	deficit,economy,federal-budget	barack-obama	President	Illinois	democrat	70	71	160	163	9	a speech in Milwaukee
8416.json	mostly-true	40,000 veterans in Texas wont get health care because Perry rejected Obamacares Medicaid expansion.	health-care,veterans	gilberto-hinojosa	Chairman, Texas Democratic Party	Texas	democrat	0	4	1	2	1	an interview on YNN’s “Capital Tonight”
4565.json	mostly-true	U.S. unemployment among people ages 16 to 24 is 18.4 percent, which is a 60-year high.	jobs,occupy-wall-street,workers	matthew-rothschild			none	0	0	0	1	0	an interview
8188.json	true	Says U.S. Sen. Ron Johnson voted to let oil and gas companies emit unlimited carbon pollution into our air	climate-change,energy,environment,transportation	league-conservation-voters			organization	0	0	0	1	0	a TV ad
8753.json	true	What do Rutgers University, Kean University, Montclair State University, New Jersey City University, Stockton College, Rowan University and William Paterson all have in common? They all graduate less than 50 percent of their students within four years.	education	joseph-cryan	State Assemblyman	New Jersey	democrat	1	1	0	0	0	an Assembly session
2082.json	mostly-true	Opponent Holly Benson said that Just because youre poor doesnt mean youre unhealthy, it just means you have a lot more time to go running.	candidates-biography,health-care	pam-bondi		Florida	republican	2	2	0	4	0	a campaign mail piece.
13117.json	true	Says a change in law he carried stopped a $100 million tax increase in the Dallas school district.	education,taxes	paul-bettencourt	state senator	Texas	republican	0	0	0	0	0	a press release
9648.json	mostly-true	Weve recovered (from the recession) faster and come farther than almost any other advanced country on Earth.	economy	barack-obama	President	Illinois	democrat	70	71	160	163	9	a speech in Delaware
4876.json	mostly-true	(Chris Christie) has not paid one dollar of state money into our pension system, and then states that the system is broke.	retirement,state-budget	loretta-weinberg	State Senator		democrat	1	2	0	1	0	a column on bluejersey.com
7320.json	mostly-true	States have cumulatively cut over $1.8 billion from their mental health services between 2009 and 2011. This is the largest reduction in state mental health services in half a century.	guns,health-care	marcy-kaptur	Representative from Ohio's Ninth Congressional District	Ohio	democrat	0	2	4	4	0	a floor speech in the House of Representatives
7638.json	mostly-true	Under Republican Chris Christie, New Jersey had the highest increase in unemployment in the country last year. Nearly 1 in 10 jobless. The worst unemployment in the region. Near the bottom in economic growth, yet Christie protected a tax cut for millionaires but vetoed a minimum wage hike.	economy,jobs,states	one-new-jersey			democrat	0	0	1	2	0	a TV ad
4826.json	true	Currently it costs more than a penny for the U.S. Mint to make a one cent coin and more than a nickel to make the five cent piece.	economy	steve-rothman			democrat	1	2	0	1	1	a statement in the Congressional Record
3439.json	mostly-true	The state of Wisconsin pays plumbers, engineers and other attorneys much, much more than it pays attorneys to represent poor people.	legal-issues,state-budget	marla-stephens	head of the appellate division of the Wisconsin state public defender’s office	Wisconsin	none	0	0	0	1	0	a statement at a candidate forum
8858.json	mostly-true	Says Peyton Manning struggles in cold weather games.	sports	tweets			none	2	3	1	2	3	comments from sports pundits and fans on Twitter
6634.json	mostly-true	Under President Bush in eight years, we added $4.9 trillion to the debt. Under President Obama, weve added $5.3 trillion to the debt in the 3.5 years hes been in office.	debt	kelly-ayotte	U.S. Senator	New Hampshire	republican	2	1	1	4	0	a town hall meeting in Merrimack, N.H.
3301.json	true	Gov. Rick Scotts sale of the state planes was not proper.	legal-issues,state-budget	jd-alexander	State senator	Florida	republican	0	1	1	1	1	comments at the Senate Budget Committee.
9400.json	mostly-true	Weve seen a remarkable reduction in the number of Americans being executed -- its down nearly two-thirds over the past generation.	criminal-justice	david-frum	Senior editor, The Atlantic		none	0	0	1	1	0	in comments on "Real Time with Bill Maher"
4326.json	mostly-true	Outside of recall elections, theres never been a public official removed from office in Wisconsin for anything but malfeasance in office.	Alcohol,city-government	bob-ryan			none	0	0	0	1	0	a city council meeting
10701.json	mostly-true	Half of all Americans have less than $10,000 in their savings account.	families,income,pensions,poverty,wealth	bernie-s	U.S. Senator	Vermont	independent	18	12	22	41	0	a talk in Austin
8572.json	true	Says theres no language in the U.S. Constitution that prevents someone from running for Congress simultaneously in multiple states.	elections	allan-levene		Georgia	republican	0	0	0	0	0	an article
2279.json	mostly-true	The United States is 50th in life expectancy in the world.	health-care	alan-grayson	U.S. House of Representatives	Florida	democrat	6	5	4	11	1	MSNBC's "The Ed Show."
3785.json	mostly-true	The turnout on May 14th was just 7 percent -- the lowest turnout in decades.	city-government,elections	randi-shade	Member, Austin City Council	Texas	democrat	0	0	1	2	0	a press release.
2295.json	true	On the mosque near ground zero.	religion	nathan-deal			republican	9	5	11	11	0	a newspaper article
497.json	true	When McCain was questioned about hiring lobbyists to his campaign staff, "his top lobbyist actually had the nerve to say, 'The American people won't care about this.' "	elections,ethics	barack-obama	President	Illinois	democrat	70	71	160	163	9	a speech in Tampa, Fla.
10098.json	mostly-true	I was speaking out on pension reform almost 17 years ago.	candidates-biography,debt,deficit,economy,government-regulation,history,job-accomplishments,labor,pensions,retirement,state-budget,state-finances,taxes,unions,wealth,workers	ernest-almonte	auditor	Rhode Island	independent	0	1	0	1	0	an interview on WLNE's "On the Record"
6151.json	true	Three of our cities are among the top five worst cities in the U.S. for asthma.	energy,environment,government-regulation,health-care,public-health,market-regulation	lamar-alexander			republican	1	2	2	0	0	prepared remarks at a Congressional field hearing.
218.json	mostly-true	Mike Huckabee "supported taxpayer-funded scholarships for illegal aliens."	immigration	mitt-romney	Former governor	Massachusetts	republican	34	32	58	33	19	a TV ad
3993.json	true	Virginia spends $400,000 on abstinence programs while losing $2.5 million in federal funds due to Gov. Bob McDonnells political agenda.	abortion,state-budget	naral-pro-choice-america			organization	1	0	1	0	0	a web video.
8460.json	mostly-true	Nearly 6 in 10 uninsured Americanscan get health insurance for what may be the equivalent of your cell phone bill.	health-care	barack-obama	President	Illinois	democrat	70	71	160	163	9	a public address
9562.json	mostly-true	Cranstons 2014-2015 budget funds 100 percent of the local police and fire pension and other retiree benefit costs.	economy,income,job-accomplishments,labor,pensions,taxes,unions,workers	allan-fung	mayor, city of Cranston, R.I.	Rhode Island	republican	2	2	0	2	1	a letter to taxpayers
2527.json	mostly-true	Says Roy Blunt secretly inserts language to benefit tobacco giant Philip Morris into a national security bill while Blunts girlfriend and son are lobbyists for the cigarette company, and just days earlier, 26 Philip Morris executives wrote checks to Blunt totaling $23,000.	campaign-finance,homeland-security,message-machine	commonsense-ten			democrat	0	0	0	1	0	a TV ad
12508.json	true	Says Donald Trump mocked someone with a disability.	disability	priorities-usa-action			democrat	3	1	4	2	1	a TV ad
2698.json	mostly-true	Bill Heller raises taxes. Property taxes. Small business taxes. He even wants to tax the Internet. Mr. Heller said no to balancing the federal budget, that puts more debt on our kids.	message-machine,taxes	jeff-brandes	Director of real estate at Tibbetts Holdings LLC, his family's business	Florida	republican	0	0	1	1	0	a campaign video
1312.json	true	"President Obama campaigned on a promise to put reproductive health care at the center of his reform plan."	abortion,health-care	planned-parenthood			none	1	0	1	0	1	an alert to members
9691.json	true	The House of Representatives has never sued a sitting president in all of U.S. history.	congress,legal-issues	nancy-pelosi	House Minority Leader	California	democrat	3	7	11	2	3	a fundraising letter
2801.json	mostly-true	Oregons budget has grown by 49 percent in just four years.	state-budget	allen-alley	Businessman	Oregon	republican	0	0	0	1	0	a website
1809.json	mostly-true	California Republican gubernatorial hopeful Meg Whitman "contributed to, and campaigned, for" Democratic Sen. Barbara Boxer.	campaign-finance,candidates-biography,elections,message-machine	steve-poizner	Insurance commissioner and gubernatorial candidate	California	republican	0	1	1	1	0	a campaign commercial
4939.json	true	Says with Jon Corzine, its the first time, I think, in history where a former Senator has been subpoenaed to testify before his former colleagues.	history	pat-roberts	U.S. Senator	Kansas	republican	1	1	0	0	0	an interview on Fox Business News
2313.json	mostly-true	Pat Toomey thinks corporations shouldnt pay any taxes.	corporations,message-machine,taxes	joe-sestak	U.S. Representative	Pennsylvania	democrat	1	0	1	1	0	a campaign commercial
11322.json	mostly-true	Theres never been a direct Supreme Court case on people who were here illegally, whether or not their kids are citizens.	immigration,legal-issues	rand-paul	Candidate for U.S. Senate and physician	Kentucky	republican	7	8	10	12	3	a presidential debate
