5540.json	mostly-true	Says there have been well over 54 million abortions since 1973.	abortion,supreme-court,women	chris-smith			republican	0	0	0	1	0	a speech on the House floor
6855.json	true	Says Portland has higher standards than feds on allowed police use of force.	city-government	sam-adams	Mayor of Portland	Oregon	democrat	3	2	5	2	0	a tweet.
11060.json	mostly-true	Cobb County businesses have already been awarded contracts worth $250 million on construction of a new Braves stadium.	baseball,county-budget,debt,economy,legal-issues	tim-lee	Cobb County Commission Chairman		republican	0	0	1	1	0	mass email
511.json	mostly-true	"Ronald Reagan met with Gorbachev; Kennedy met with Khruschev; and Nixon met with Mao and these were folks who have done horrendous damage not only to their own countries but to other countries."	foreign-policy	barack-obama	President	Illinois	democrat	70	71	160	163	9	an interview on Fox News' <i>America's Election HQ</i>
2131.json	true	The Latino unemployment rate is higher than the white rate and the black rate is higher than the Latino rate.	diversity,economy,workers	marc-morial	President of the National Urban League	Louisiana	democrat	0	0	1	0	0	a roundtable discussion on NBC's "Meet the Press"
9615.json	mostly-true	Says the Obama administration never responded to his 2012 letter flagging the uptick in unaccompanied children crossing the U.S.-Mexico border.	immigration	rick-perry	Governor	Texas	republican	30	30	42	23	18	an interview on Fox & Friends
6023.json	mostly-true	The last three days of early voting happen to be the most populated days of voting that we have in early voting.	elections	ron-gerberry	State representative	Ohio	democrat	0	0	0	1	0	a news conference
12530.json	mostly-true	Last year, 244 suspected terrorists walked into gun shops and attempted to purchase a firearm; 223 were able to get the firearm.	congress,crime,government-regulation,guns,homeland-security,public-safety,terrorism	charles-schumer	Senator	New York	democrat	2	2	2	3	0	a news conference
3105.json	mostly-true	Poll results from the past 35 years show that State of the Union speeches do not move presidential approval numbers.	history,polls,abc-news-week	matthew-dowd	Commentator	Texas	independent	0	0	2	4	0	an interview on ABC's "This Week with Christiane Amanpour"
9852.json	mostly-true	Pinnacle Overlook in Southwest Virginia is closer to eight other state capitals than to Richmond.	states	tim-kaine	U.S. Senator	Virginia	democrat	8	3	15	15	0	a tweet.
1619.json	true	The cost to implement Florida's class size amendment so far has been "$16 billion."	education	don-gaetz	State Senator	Florida	republican	1	0	3	1	0	debate on the Senate floor.
1924.json	true	"Obama put a 10 percent tax on tanning."	health-care	snooki			none	0	0	0	0	0	a video promo for "Jersey Shore"
8820.json	mostly-true	Obamacare passed by just one vote in the Senate. It wouldnt have passed without Mark Warners vote.	health-care,voting-record	ed-gillespie	Republican strategist	Washington, D.C.	republican	2	3	2	2	1	a web ad.
4254.json	mostly-true	Says Adam Hasners record includes requesting over $92.2 million in earmarks.	state-budget	george-lemieux		Florida	republican	4	1	6	4	0	a Web post Aug. 1, 2011
8442.json	mostly-true	No one beta-tested healthcare.gov.	health-care,pundits,technology	sam-stein	Political Editor and White House Correspondent, Huffington Post	Washington, D.C.	journalist	0	0	0	1	0	an interview on MSNBC's 'Morning Joe'
12062.json	mostly-true	Susie Lee and her husband own 17 homes across the country and use their private jet to take vacations, and invest in companies like Walmart, Halliburton and GEO Group.	candidates-biography	culinary-workers-union		Nevada	labor-leader	0	0	0	1	0	a letter sent to union members
4103.json	mostly-true	Says for the first time in the history of the United States, the government cut taxes during wartime	afghanistan,bush-administration,corrections-and-updates,iraq,taxes	cory-booker	U.S. senator	New Jersey	democrat	0	4	2	8	0	an interview on NPR’s “Tell Me More” with Michel Martin
8178.json	true	Says he sued Obamas EPA seven times.	energy,environment	barry-smitherman	Member, Texas Railroad Commission	Texas	republican	0	0	1	0	1	a campaign video
11046.json	mostly-true	A working woman will earn $7.70 on $10.	income,labor,women,workers	tom-toles			none	0	0	0	1	0	an editorial cartoon
10392.json	mostly-true	Georgia is now the eighth most populous state in the nation, moving from the number 10 position in just four years.	census,economy	nathan-deal			republican	9	5	11	11	0	the governor's State of the State address
6867.json	mostly-true	Says Travis County Sheriff Greg Hamilton has accepted $42,000 from strip-club interests and $10,000 from local alcohol distributors.	campaign-finance,crime,criminal-justice	raymond-frank	Retiree	Texas	republican	0	0	0	1	0	an advertisement.
1040.json	true	President Obama will now own 60 percent of GM, and his union buddies will own almost 20 percent.	bankruptcy,market-regulation	michael-steele	chairman of the Republican National Committee	Maryland	republican	0	1	1	0	2	a press release.
13065.json	mostly-true	If upstate New York split from downstate the economic indicators of upstate New York would be among the lowest in the country.	economy,jobs	bob-duffy	President of the Rochester Business Alliance	New York	democrat	0	0	0	1	0	an op-ed in the Rochester Business Journal
12040.json	mostly-true	When New York Gov. Eliot Spitzer wanted to provide drivers licenses to those who are undocumented. (Hillary Clinton) said dont do it.	immigration	bernie-s	U.S. Senator	Vermont	independent	18	12	22	41	0	a Democratic debate in Miami
1866.json	true	Californias credit rating is the worst in the country.	economy,message-machine,state-budget	jerry-brown		California	democrat	0	0	3	2	0	a video on his campaign website
6171.json	mostly-true	Just in the past 10 years, college tuition has increased 28 percent.	education	albio-sires	Congressman	New Jersey	democrat	0	0	0	1	0	a speech on the House floor
4657.json	mostly-true	Says if you are shot in the city of Newark, you have over an 80 percent chance that youve been arrested before an average of 10 times.	crime,criminal-justice,guns	cory-booker	U.S. senator	New Jersey	democrat	0	4	2	8	0	a radio interview on WBGO’s “Newark Today”
777.json	mostly-true	McCain intervened on behalf of Charles Keating with federal regulators... that allowed Keating to continue his fraud at an incredible cost to taxpayers.	candidates-biography	barack-obama	President	Illinois	democrat	70	71	160	163	9	a Web site
7923.json	true	Since Newtown, more people have died at the end of a gun than we have lost in Afghanistan.	guns	joe-biden	U.S. senator	Delaware	democrat	11	10	21	16	4	a tweet from Barack Obama's Twitter feed
10444.json	true	Only 18 percent of jobs are accessible by transit for metro Atlanta residents. 33 percent for those living in the city.	economy,transportation	keith-parker	General Manager, MARTA	Georgia	none	0	0	0	0	0	a Twitter post
98.json	true	"With those first principles, it allowed a fellow like me to get in his truck and go from one end of the state to the other; started 20 points down and wound up 20 points ahead on election night."	elections	fred-thompson	Actor	Tennessee	republican	1	4	3	3	0	Washington, D.C.
691.json	true	"That luxury jet was over the top. I put it on eBay."	transportation	sarah-palin		Alaska	republican	9	19	9	6	6	a speech in St. Paul, Minn.
527.json	true	John McCain opposed bankruptcy protections for families "who were only in bankruptcy because of medical expenses they couldn't pay."	bankruptcy	barack-obama	President	Illinois	democrat	70	71	160	163	9	a speech in Chicago, Ill.
9466.json	mostly-true	Thousands of Westerners and Americans are fighting with extremists in eastern Syria and Iraq.	homeland-security,iraq,islam,military,terrorism	mike-rogers	national security commentator for CNN	Michigan	republican	1	1	1	2	1	an interview on "Fox News Sunday"
12634.json	mostly-true	Says Hillary Clinton was literally present when we pressed the reset button with Russia just a few months after Russia had invaded Georgia.	foreign-policy	tom-cotton	U.S. House of Representatives	Arkansas	republican	3	4	2	3	1	an interview on "Meet the Press"
1624.json	true	"Our national debt ... is on track to exceed the size of our entire economy ... in just two more years."	federal-budget	john-boehner	Speaker of the House of Representatives	Ohio	republican	13	22	11	4	2	an op-ed in the Des Moines Register
2300.json	mostly-true	The IRS filed an $11,000 lien against (Allen) West for back taxes. Three liens were placed on his home for unpaid bills, and a judge ordered West to pay over $5,000 for past due credit card bills.	candidates-biography,message-machine	ron-klein		Florida	democrat	0	2	0	1	0	a campaign TV advertisement.
5321.json	true	If you take into account all the people who are struggling for work, or have just stopped looking, the real unemployment rate is over 15 percent.	economy,jobs	mitt-romney	Former governor	Massachusetts	republican	34	32	58	33	19	a speech in Las Vegas, Nev., on Feb. 4, 2012
8394.json	true	A congressional laundry closed due to the partial government shutdown.	debt,federal-budget	roger-williams	Businessman	Texas	republican	3	2	2	0	1	as quoted in a newspaper article
7260.json	true	Gross income tax receipts are exceeding the Administrations projections for this fiscal year prior to Sandy.	state-finances	chris-christie	Governor of New Jersey	New Jersey	republican	10	17	27	19	8	State of the State address
1590.json	true	Because of a local version of Amendment 4, the taxpayers of St. Pete Beach have had to pay hundreds of thousands in legal bills.	economy,florida-amendments,taxes	citizens-lower-taxes-and-stronger-economy		Florida	none	1	0	2	0	1	an Internet ad.
1101.json	mostly-true	Doctors, nurses, hospitals, even the pharmaceutical industry, (and) AARP say that health reform makes sense to do.	health-care	barack-obama	President	Illinois	democrat	70	71	160	163	9	a speech on health care reform
1097.json	mostly-true	There were more job losses per month in the last three months under President Bush than in the past three months under President Obama.	economy,stimulus	steny-hoyer	House Majority Leader	Maryland	democrat	0	1	3	4	0	a statement on the House floor.
6001.json	mostly-true	Says he earned the highest possible credit ratings as state treasurer.	government-efficiency,job-accomplishments,message-machine-2012	josh-mandel	Ohio treasurer	Ohio	republican	4	5	4	5	6	a campaign commercial
9179.json	true	The Capitol rotunda was actually made to invite the people in and to accommodate protests.	legal-issues	chris-taylor			democrat	1	0	0	1	0	a video
11389.json	mostly-true	More preschoolers are shot dead each year than police officers are in the line of duty.	guns	nicholas-kristof			none	0	1	0	2	0	a New York Times op-ed
12055.json	mostly-true	Americans havent had a raise in 15 years.	income	hillary-clinton	Presidential candidate	New York	democrat	40	29	69	76	7	a Hillary for America ad
963.json	mostly-true	"We had bipartisan legislation that got through the Senate" that would have prevented bonuses like AIG's "and then somehow mysteriously disappeared."	corporations,economy	ron-wyden	U.S. Senator	Oregon	democrat	0	1	0	3	0	an interview on The Rachel Maddow Show
3115.json	true	The United States has one of the highest corporate tax rates in the world.	corporations,economy,taxes	barack-obama	President	Illinois	democrat	70	71	160	163	9	the State of the Union address
290.json	mostly-true	"Barack (Obama) has one of his biggest supporters in terms of funding, the Exelon Corporation, which has spent millions of dollars trying to make Yucca Mountain the waste depository."	ethics	hillary-clinton	Presidential candidate	New York	democrat	40	29	69	76	7	Las Vegas
11935.json	mostly-true	The Arizona State Board of Educations failure to report teachers whose certifications have been revoked or suspended ... resulted in the death of a student.	education	diane-douglas	State Superintendent of Public Instruction		education-official	0	0	0	1	0	remarks made during a state Senate Education Committee meeting.
1852.json	true	Charlie Crist "bizarrely vetoed" $9.7 million for a teaching hospital at the University of Florida "despite having previously argued the budget request had merit."	health-care,state-budget	marco-rubio	U.S. Senator	Florida	republican	33	24	32	35	5	comments on his campaign website
11944.json	mostly-true	About 70 percentof Republicans nationwide ...dont think Donald Trump is the right guy to take on Hillary Clinton in November.	elections,polls	ted-cruz	Senator	Texas	republican	36	33	15	19	8	an interview on "Meet the Press"
1585.json	mostly-true	"House Speaker Nancy Pelosi said this week that the Democrats have to pass their terrible health care bill so that the American people can actually find out what's in it."	health-care	republican-party-texas		Texas	republican	3	1	1	3	1	an e-mail blast
9696.json	mostly-true	Israel in the last three weeks haskilled more Palestinian children, more than 200, than the total number of Israeli soldiers killed in military operations since 2006.	children,foreign-policy,israel,military	jake-tapper	Host of CNN's "The Lead"		journalist	0	0	0	1	0	comments on CNN
1546.json	mostly-true	"Our graduation rate is the highest it's ever been."	education	charlie-crist		Florida	democrat	15	9	20	19	2	his State of the State address
13219.json	mostly-true	Says Patrick Murphy supports a gun ban on commonly owned semi-automatic firearms used for hunting, recreational shooting and self defense.	guns	national-rifle-association			none	3	5	1	5	3	a campaign mailer
8739.json	mostly-true	There are many studies that indicate that the longer people get unemployment insurance, it provides some disincentive to work.	economy,workers	rand-paul	Candidate for U.S. Senate and physician	Kentucky	republican	7	8	10	12	3	an interview on ABC's "This Week with George Stephanopoulos"
6149.json	true	Under current law, if you go on a dating website and you say youre 32 and youre actually 42, youve committed a misdemeanor.	legal-issues,pop-culture,technology	christopher-blazejewski	Rhode Island State Representative	Rhode Island	democrat	0	1	0	0	0	a speech on the floor of the Rhode Island House (which was transmitted electronically)
7824.json	true	The proposed raises for the Norcross City Council would put it in line with other liked-sized communities.	city-budget,city-government	norcross-city-council		Georgia	none	0	0	0	0	0	an article
3505.json	true	There has never been a death caused by a [commercial nuclear] reactor in the United States, even when Three Mile Island failed in the 1970s.	nuclear	johnny-isakson	U.S. Senator	Georgia	republican	2	3	3	2	0	a YouTube.com video
408.json	true	Obama spent "40 percent of the PAC money, 43 percent to be exact, on Iowa, New Hampshire, Nevada and South Carolina politicians."	ethics	bill-clinton	former president	Arkansas	democrat	4	2	12	11	3	an interview with the mtvU editorial board
1429.json	mostly-true	"For the first time in history, my administration posts our White House visitors online."	ethics,legal-issues,transparency	barack-obama	President	Illinois	democrat	70	71	160	163	9	a State of the Union speech
7358.json	true	Says Texas ranks last in the percentage of residents with high school diplomas.	education,pundits	sacramento-bee-editorial-board			none	1	0	1	1	0	an editorial.
6632.json	true	Says Bruce Springsteen played in 1975 at Seton Hall University in South Orange at Walsh gym.	pop-culture	chris-christie	Governor of New Jersey	New Jersey	republican	10	17	27	19	8	an appearance on Late Night with Jimmy Fallon
2208.json	true	The overall fact about illegal immigration is that its not actually getting worse.	immigration,pundits	rachel-maddow	MSNBC host		none	6	6	4	6	1	"The Rachel Maddow Show"
9895.json	true	More people are apprehended after illegally crossing the U.S.-Mexico border a week than are born in Texas each week.	children,immigration,population	dan-patrick	Lieutenant governor-elect	Texas	republican	4	4	3	4	4	an interview with Laura Ingraham
3801.json	true	For more than 30 years after World War II, there was a steady reduction in U.S. debt as a percentage of gross domestic product.	deficit,economy	bob-mcdonnell	Governor	Virginia	republican	6	5	7	6	3	an interview.
303.json	true	"While I was working on those streets watching those folks see their jobs shift overseas, you were a corporate lawyer sitting on the board at Wal-Mart."	candidates-biography	barack-obama	President	Illinois	democrat	70	71	160	163	9	a debate in Myrtle Beach, S.C.
7791.json	mostly-true	Says its estimated that 300 babies a year are sent home from the hospital with an unrecognized congenital heart defect; it is the most common birth defect in America.	children,health-care,public-health	robert-deuell	Physician	Texas	republican	0	0	0	1	0	remarks on the floor of the Texas Senate.
9105.json	mostly-true	Rick Scott tried to slash school funding by $3.3 billion.	education,state-budget	charlie-crist		Florida	democrat	15	9	20	19	2	his campaign website
4190.json	true	The deficit was on track to top $1 trillion the year I took office.	deficit,federal-budget	barack-obama	President	Illinois	democrat	70	71	160	163	9	a televised address
11833.json	mostly-true	As part of legislative fights over abortion rights,Mike Coffman co-sponsored a bill to redefine rape.	abortion,corrections-and-updates,crime,criminal-justice,women	emilys-list			organization	1	0	3	2	0	a fundraising email
7350.json	mostly-true	Says each year approximately 30,000 people in the United States die as a result of gunfire, and about 80,000 people are wounded.	guns	joyce-beatty	Member of Congress	Ohio	democrat	1	0	0	1	0	a floor speech in the House of Representatives
12573.json	mostly-true	When he served as governor, Schwarzenegger preserved more land than any other gubernatorial administration in Californias history.	environment	bonnie-reiss	Global Director at USC Schwarzenegger Institute	California	democrat	0	0	0	1	0	a newspaper column.
11450.json	mostly-true	Rep. Peter Petrarca voted on two pieces of legislation that helped auto body shops ... and at that point I think there is a conflict of interest.	economy,ethics	gregory-j-costantino		Rhode island	democrat	0	0	0	1	0	a television interview
734.json	mostly-true	Obama says McCain went to Bermuda and "pledged to protect tax breaks for American corporations that hide their profits offshore."	taxes	barack-obama	President	Illinois	democrat	70	71	160	163	9	in a television ad
7363.json	mostly-true	Says Texas is last in mental health expenditures.	health-care,pundits	sacramento-bee-editorial-board			none	1	0	1	1	0	an editorial
3802.json	mostly-true	Says the Obama Administration has fulfilled all of Texas requests for fire management assisting grants.	natural-disasters	jay-carney	White House press secretary	District of Columbia	none	2	2	1	2	0	a press gaggle
6269.json	mostly-true	Says federal debt doubled during the Bush administration.	debt,federal-budget	paul-sadler	Lawyer	Texas	democrat	1	0	1	2	1	a debate of Democratic primary runoff candidates for U.S. Senate in Dallas
8211.json	mostly-true	Offshore wind power is significantly less expensive than solar energy.	energy,environment	jeffrey-grybowski	CEO of Deepwater Wind	Rhode Island	business-leader	0	0	0	1	0	a television interview
7975.json	mostly-true	Says $800,000 cost of Texas special legislative session would pay for 1.6 million condoms, 90,000 months of the pill or 20 full-time sexual health educators.	abortion	sarah-ponder	Austinite	Texas	democrat	0	0	0	1	0	a rally at the state Capitol
13435.json	mostly-true	(Deborah) Ross defends those who want to burn the American flag, and even called efforts to ban flag-burning ridiculous, yet refused to help a disabled veteran fly the flag.	legal-issues,military,campaign-advertising,patriotism,veterans	senate-leadership-fund			republican	0	0	1	1	0	a TV ad
18.json	mostly-true	An estimated 56 million Americans don't have bank accounts.	economy	john-edwards	former senator	North Carolina	democrat	0	2	4	4	1	New York City.
7668.json	true	The NRA used to support expanded background checks.	guns	barack-obama	President	Illinois	democrat	70	71	160	163	9	remarks in the White House Rose Garden
5476.json	mostly-true	[E]mployment in Gwinnett is up more than 3 percent over last year, and unemployment is the lowest of the five core metro counties.	economy,jobs	charlotte-nash		Georgia	republican	1	0	1	2	0	a speech
4218.json	mostly-true	Social Security didnt cause the debt crisis. Social Security had nothing to do with the debt crisis.	deficit,economy,social-security	dennis-kucinich	U.S. representative	Ohio	democrat	1	3	4	6	0	a speech in the House of Representatives
6752.json	true	Says that in the U.S. House of Representatives weve had bipartisan support for the repeal of Obamacare for getting rid of cap and trade for building the Keystone Pipeline.	bipartisanship,climate-change,congress,congressional-rules,voting-record	marsha-blackburn	U.S. Representative	Tennessee	republican	2	2	1	0	0	an appearance on "Face the Nation" on CBS
5382.json	true	Wrong precinct rules exacerbate our provisional ballot problems (and) HB 194 does nothing to solve the wrong-precinct problem.	elections	kathleen-clyde	State representative	Ohio	democrat	0	0	0	0	0	an email
13310.json	true	Says Donald Trump used undocumented labor to build the Trump Tower.	candidates-biography,immigration	hillary-clinton	Presidential candidate	New York	democrat	40	29	69	76	7	in a debate
2318.json	true	Sharron Angle would eliminate the Department of Education.	education,legal-issues,message-machine,states	harry-reid	Senate Democratic Leader	Nevada	democrat	4	5	3	7	3	a campaign commercial
3318.json	mostly-true	An illegal immigrant who gains admission at a public college takes class space away from students who are legal residents.	education,immigration	don-balfour			republican	0	0	0	2	0	a committee hearing
7151.json	true	The five economic indicators that the federal government tracks - for the first time since August 2006 - were positive this October.	economy	lincoln-chafee		Rhode Island	democrat	3	5	3	4	0	a newspaper interview
8937.json	mostly-true	Says(President) Reagans second inaugural was moved inside the Capitol. It was. Because of a terrible snowstorm.	history,weather	peggy-noonan	Columnist, Wall Street Journal		journalist	0	0	0	1	0	a broadcast of ABC's "This Week"
7088.json	true	Says a poll shows that without a name attached, Democrats are just one point behind Gov. John Kasich.	elections,polls	chris-redfern	Chairman of the  Ohio Democratic Party	Ohio	democrat	0	0	2	4	0	a news conference
5402.json	mostly-true	The governor is trying to take credit for recent actions taken by these companies. The problem is that for all three companies, the decision to move or stay in New Jersey happened before Chris Christie became governor.	corporations	new-jersey-senate-democrats	State Senators	New Jersey	democrat	0	0	0	1	0	a press release
10323.json	true	My property taxes went down largely because my technical college portion went down 35.5% because of the money we put in at state.	taxes	scott-walker	Milwaukee County Executive	Wisconsin	republican	26	41	32	40	11	a tweet
743.json	mostly-true	"He has asked for $932-million of earmark pork-barrel spending, nearly a million dollars for every day that hes been in the United States Senate."	federal-budget	john-mccain	U.S. senator	Arizona	republican	31	39	31	37	8	in debate in Oxford, Miss.
1965.json	mostly-true	Canada "does spills into their water to practice in the event that this would happen. That is not allowed in the United States."	energy,environment,oil-spill	mary-landrieu	U.S. Senator	Louisiana	democrat	0	1	0	2	0	comments on 'Meet The Press'
12413.json	mostly-true	The geography of poverty has changed fundamentally in the last 15 years, with more of it concentrated in fragile and conflict states.	foreign-policy	david-miliband			none	0	0	0	1	0	a panel discussion
4024.json	mostly-true	For every dollar we invest in Head Start, we get $5 to $7 back into our economy.	children,federal-budget	tim-ryan	U.S. representative 	Ohio	democrat	0	0	0	5	1	an interview on Fox News
435.json	true	Says she is the subject of 60 books.	candidates-biography	hillary-clinton	Presidential candidate	New York	democrat	40	29	69	76	7	a forum on faith-related issues at Messiah College in Grantham, Penn.
4433.json	true	In writing his book, Gov. Perry pointed out that by any measure Social Security has been a failure.	social-security	mitt-romney	Former governor	Massachusetts	republican	34	32	58	33	19	the CNN-Tea Party Express debate in Tampa
11564.json	true	Will Hurd tends to have a 96 percent straight Republican, straight party voting record.	bipartisanship,congress,redistricting,voting-record	pete-gallego	Former legislator and U.S. House member	Texas	democrat	1	1	2	2	0	a blog post by the Texas Tribune
8530.json	mostly-true	Says Chris Christie vetoed Planned Parenthood funding five times over the course of his governorship.	abortion,women	hilary-rosen			democrat	0	0	0	2	0	comments on CNN's "State of the Union"
11029.json	true	Greece is not a big economy. Its about the size of metropolitan Miami.	economy,foreign-policy	paul-krugman	New York Times columnist		none	0	2	3	4	0	an interview on ABC's "This Week with George Stephanopoulos"
12460.json	mostly-true	Ive cut the budget of the (lieutenant governors) office by more than half.	state-budget	carlos-lopez-cantera	lieutenant governor	Florida	republican	0	0	0	2	0	in an interview with Fox 13 
2065.json	true	Forty cents of every dollar being spent by the federal government is being borrowed from my children.	federal-budget	marco-rubio	U.S. Senator	Florida	republican	33	24	32	35	5	a Fox News interview
